{"format":"regionwright.point-board","formatVersion":1,"width":240,"height":160,"palette":["#564329","#987345","#d1aa5c","#e5d49a","#bcc8be","#dc6244"],"layers":[{"id":"static","frames":[[[42,21,3],[45,21,2],[48,21,2],[51,21,2],[54,21,2],[57,21,2],[60,21,2],[63,21,2],[66,21,2],[69,21,2],[72,21,2],[75,21,2],[78,21,2],[81,21,2],[84,21,2],[87,21,2],[90,21,2],[93,21,2],[96,21,2],[99,21,2],[102,21,2],[105,21,2],[108,21,2],[111,21,2],[114,21,2],[117,21,2],[120,21,2],[123,21,2],[126,21,2],[129,21,2],[132,21,2],[135,21,2],[138,21,2],[141,21,2],[144,21,2],[147,21,2],[150,21,2],[153,21,2],[156,21,2],[159,21,2],[162,21,2],[165,21,2],[168,21,2],[171,21,2],[174,21,2],[177,21,2],[180,21,2],[183,21,2],[186,21,2],[189,21,2],[192,21,2],[195,21,2],[198,21,3],[39,24,3],[39,27,3],[36,27,3],[33,30,3],[33,33,3],[30,33,2],[201,24,3],[201,27,3],[204,27,3],[207,30,3],[207,33,3],[210,33,2],[30,36,2],[30,39,2],[30,42,2],[30,45,2],[30,48,2],[30,51,2],[30,54,2],[30,57,2],[30,60,2],[30,63,2],[30,66,2],[30,69,2],[30,72,2],[30,75,2],[30,78,2],[30,81,2],[30,84,2],[30,87,2],[30,90,2],[30,93,2],[30,96,2],[30,99,2],[30,102,2],[30,105,2],[30,108,2],[30,111,2],[30,114,2],[30,117,2],[30,120,2],[30,123,2],[30,126,3],[210,36,2],[210,39,2],[210,42,2],[210,45,2],[210,48,2],[210,51,2],[210,54,2],[210,57,2],[210,60,2],[210,63,2],[210,66,2],[210,69,2],[210,72,2],[210,75,2],[210,78,2],[210,81,2],[210,84,2],[210,87,2],[210,90,2],[210,93,2],[210,96,2],[210,99,2],[210,102,2],[210,105,2],[210,108,2],[210,111,2],[210,114,2],[210,117,2],[210,120,2],[210,123,2],[210,126,3],[33,129,3],[36,132,3],[39,135,3],[42,138,2],[207,129,3],[204,132,3],[201,135,3],[198,138,2],[45,138,2],[48,138,2],[51,138,2],[54,138,2],[57,138,2],[60,138,2],[63,138,2],[66,138,2],[69,138,2],[72,138,2],[75,138,2],[78,138,2],[81,138,2],[84,138,2],[87,138,2],[90,138,2],[93,138,2],[96,138,2],[99,138,2],[102,138,2],[105,138,2],[108,138,2],[111,138,2],[114,138,2],[117,138,2],[120,138,2],[123,138,2],[126,138,2],[129,138,2],[132,138,2],[135,138,2],[138,138,2],[141,138,2],[144,138,2],[147,138,2],[150,138,2],[153,138,2],[156,138,2],[159,138,2],[162,138,2],[165,138,2],[168,138,2],[171,138,2],[174,138,2],[177,138,2],[180,138,2],[183,138,2],[186,138,2],[189,138,2],[192,138,2],[195,138,2],[39,30,1],[42,30,2],[45,30,2],[48,30,1],[51,30,1],[54,30,1],[57,30,1],[60,30,1],[63,30,1],[66,30,1],[69,30,1],[72,30,1],[75,30,1],[78,30,1],[81,30,1],[84,30,1],[87,30,1],[90,30,1],[93,30,1],[96,30,1],[99,30,1],[102,30,1],[105,30,1],[108,30,1],[111,30,1],[114,30,1],[117,30,1],[120,30,1],[123,30,0],[126,30,1],[129,30,2],[132,30,2],[135,30,2],[138,30,1],[141,30,1],[144,30,3],[147,30,3],[150,30,1],[153,30,3],[156,30,1],[159,30,1],[162,30,2],[165,30,2],[168,30,2],[171,30,1],[174,30,0],[177,30,1],[180,30,1],[183,30,1],[186,30,1],[189,30,1],[192,30,1],[195,30,2],[198,30,2],[201,30,2],[39,129,2],[42,129,2],[45,129,2],[48,129,2],[51,129,1],[54,129,1],[57,129,1],[60,129,1],[63,129,1],[66,129,1],[69,129,1],[72,129,1],[75,129,1],[78,129,1],[81,129,1],[84,129,1],[87,129,1],[90,129,1],[93,129,1],[96,129,1],[99,129,1],[102,129,1],[105,129,1],[108,129,1],[111,129,1],[114,129,1],[117,129,1],[120,129,0],[123,129,0],[126,129,2],[129,129,2],[132,129,2],[135,129,1],[138,129,3],[141,129,1],[144,129,3],[147,129,3],[150,129,1],[153,129,3],[156,129,3],[159,129,1],[162,129,1],[165,129,2],[168,129,2],[171,129,2],[174,129,0],[177,129,0],[180,129,1],[183,129,1],[186,129,1],[189,129,1],[192,129,2],[195,129,2],[198,129,2],[201,129,2],[39,33,2],[39,36,2],[39,39,2],[39,42,1],[39,45,1],[39,48,1],[39,51,1],[39,54,1],[39,57,1],[39,60,1],[39,63,1],[39,66,1],[39,69,1],[39,72,1],[39,75,1],[39,78,1],[39,81,1],[39,84,1],[39,87,1],[39,90,1],[39,93,1],[39,96,1],[39,99,1],[39,102,1],[39,105,1],[39,108,1],[39,111,1],[39,114,1],[39,117,1],[39,120,1],[39,123,2],[39,126,2],[201,33,2],[201,36,2],[201,39,2],[201,42,1],[201,45,1],[201,48,1],[201,51,1],[201,54,1],[201,57,1],[201,60,0],[201,63,1],[201,66,0],[201,69,2],[201,72,2],[201,75,2],[201,78,1],[201,81,2],[201,84,2],[201,87,2],[201,90,2],[201,93,1],[201,96,0],[201,99,0],[201,102,1],[201,105,1],[201,108,1],[201,111,1],[201,114,1],[201,117,1],[201,120,2],[201,123,2],[201,126,2],[48,48,1],[51,48,1],[54,48,1],[57,48,1],[60,48,1],[66,48,3],[48,57,2],[51,57,2],[54,57,2],[57,57,2],[60,57,2],[66,57,3],[48,66,1],[51,66,1],[54,66,1],[57,66,1],[60,66,1],[66,66,3],[48,75,2],[51,75,2],[54,75,2],[57,75,2],[60,75,2],[66,75,3],[48,84,1],[51,84,1],[54,84,1],[57,84,1],[60,84,1],[66,84,3],[48,93,2],[51,93,2],[54,93,2],[57,93,2],[60,93,2],[66,93,3],[48,102,1],[51,102,1],[54,102,1],[57,102,1],[60,102,1],[66,102,3],[48,111,2],[51,111,2],[54,111,2],[57,111,2],[60,111,2],[66,111,3],[75,45,0],[84,45,0],[93,45,0],[75,51,0],[84,51,0],[93,51,0],[75,57,0],[84,57,0],[93,57,0],[75,63,0],[84,63,0],[93,63,0],[75,69,0],[84,69,0],[93,69,0],[75,75,0],[84,75,0],[93,75,0],[75,81,0],[84,81,0],[93,81,0],[75,87,0],[84,87,0],[93,87,0],[75,93,0],[84,93,0],[93,93,0],[75,99,0],[84,99,0],[93,99,0],[75,105,0],[84,105,0],[93,105,0],[75,111,0],[84,111,0],[93,111,0],[48,36,2],[48,39,2],[45,39,2],[42,39,2],[48,33,2],[42,36,3],[45,36,3],[198,39,2],[195,39,2],[192,39,2],[192,36,2],[192,33,2],[195,36,3],[198,36,3],[48,126,2],[42,120,2],[45,120,2],[48,123,2],[42,126,3],[45,126,3],[192,126,2],[192,123,2],[195,120,2],[198,120,2],[195,126,3],[198,126,3],[204,81,0],[204,84,0],[204,87,0],[204,93,0],[198,102,0],[198,105,0],[195,111,0],[192,114,0],[192,117,0],[189,120,0],[186,123,0],[183,123,0],[180,126,0],[168,132,0],[165,132,0],[162,135,0],[159,135,0],[153,135,0],[150,135,0],[147,135,0],[141,135,0],[138,135,0],[135,135,0],[132,132,0],[126,132,0],[117,126,0],[114,123,2],[111,123,0],[108,120,0],[105,117,0],[102,114,0],[102,111,0],[99,105,0],[96,102,0],[96,99,0],[93,96,0],[93,84,0],[93,72,0],[93,66,0],[96,60,0],[96,57,0],[99,54,0],[102,51,2],[102,48,0],[105,45,0],[108,42,0],[111,39,0],[114,36,0],[117,33,0],[120,33,2],[126,27,0],[132,27,0],[135,27,0],[138,24,0],[141,24,0],[147,24,0],[150,24,0],[153,24,0],[159,24,0],[162,27,0],[165,27,0],[168,27,0],[177,33,0],[180,33,0],[183,36,0],[186,39,0],[189,42,0],[192,45,0],[192,48,2],[195,51,0],[198,54,0],[198,57,0],[204,69,0],[204,72,0],[204,75,0],[198,96,2],[198,99,2],[195,102,2],[195,105,2],[192,108,2],[192,111,2],[189,114,2],[186,117,2],[183,120,2],[180,123,2],[177,123,2],[174,126,2],[162,132,2],[156,132,2],[153,132,2],[150,132,2],[147,132,2],[141,132,2],[138,132,2],[135,132,2],[123,126,2],[117,123,2],[114,120,2],[111,117,2],[108,114,2],[105,111,2],[102,108,2],[102,105,2],[99,102,2],[99,99,2],[96,96,2],[96,90,2],[96,87,2],[96,84,2],[96,81,2],[96,75,2],[96,72,2],[96,69,2],[96,66,2],[99,63,2],[99,57,2],[102,54,2],[105,48,2],[108,45,2],[111,42,2],[114,42,2],[114,39,2],[117,36,2],[126,33,2],[138,27,2],[141,27,2],[147,27,2],[150,27,2],[153,27,2],[156,27,2],[171,33,2],[174,33,2],[177,36,2],[180,39,2],[183,42,2],[186,42,2],[189,45,2],[192,51,2],[195,54,2],[195,57,2],[198,63,2],[198,66,2],[198,81,3],[198,84,3],[195,90,3],[195,93,1],[195,96,3],[192,102,3],[189,105,1],[189,108,3],[186,111,3],[183,114,3],[180,117,3],[177,120,3],[174,123,1],[168,123,3],[165,126,3],[162,126,3],[135,126,1],[132,126,3],[126,123,3],[123,123,1],[120,120,3],[117,117,3],[114,114,3],[111,111,3],[108,108,3],[105,105,1],[105,102,3],[102,96,3],[102,93,1],[99,90,3],[99,84,3],[99,81,3],[99,75,3],[99,72,3],[102,66,3],[102,63,3],[105,60,3],[105,54,1],[108,51,3],[111,48,3],[114,45,3],[117,42,3],[120,39,3],[123,39,1],[126,36,3],[132,33,3],[135,33,1],[138,33,3],[156,33,3],[162,33,1],[165,33,3],[168,36,3],[174,39,3],[177,39,3],[180,42,3],[183,45,3],[186,48,3],[189,51,3],[189,54,3],[192,60,3],[195,63,3],[195,66,1],[195,72,3],[198,75,3],[192,81,3],[195,81,3],[192,93,1],[189,102,1],[192,105,1],[177,111,3],[180,111,3],[171,120,1],[171,123,1],[159,123,1],[159,126,1],[147,123,3],[147,126,3],[135,123,1],[126,120,1],[117,111,3],[108,102,1],[105,93,1],[99,93,1],[105,81,3],[102,81,3],[105,69,1],[102,69,1],[99,66,1],[108,57,1],[105,57,1],[117,51,3],[117,48,3],[126,39,1],[123,36,1],[135,36,1],[147,36,3],[147,33,3],[159,36,1],[159,33,1],[171,39,1],[174,36,1],[177,51,3],[180,48,3],[189,57,1],[192,54,1],[192,69,1],[195,69,1],[150,81,3],[150,84,3],[147,84,3],[147,81,3],[144,81,3],[144,78,3],[147,78,3],[150,78,3]]],"animation":{"idleFrame":0}},{"id":"cylinder","frames":[[[187,80,1],[187,83,1],[187,86,1],[187,89,1],[187,92,1],[187,95,1],[184,95,1],[184,98,1],[181,101,1],[181,104,1],[178,107,1],[175,110,1],[172,113,1],[169,113,1],[169,116,1],[166,116,1],[163,116,1],[160,119,1],[157,119,1],[154,119,1],[151,119,1],[148,119,1],[145,119,1],[142,119,1],[139,119,1],[136,119,1],[133,116,1],[130,116,1],[127,116,1],[127,113,1],[124,113,1],[121,110,1],[118,107,1],[115,104,1],[115,101,1],[112,98,1],[112,95,1],[109,95,1],[109,92,1],[109,89,1],[109,86,1],[109,83,1],[109,80,1],[109,77,1],[109,74,1],[109,71,1],[109,68,1],[109,65,1],[112,65,1],[112,62,1],[115,59,1],[115,56,1],[118,53,1],[121,50,1],[124,47,1],[127,47,1],[127,44,1],[130,44,1],[133,44,1],[136,41,1],[139,41,1],[142,41,1],[145,41,1],[148,41,1],[151,41,1],[154,41,1],[157,41,1],[160,41,1],[163,44,1],[166,44,1],[169,44,1],[169,47,1],[172,47,1],[175,50,1],[178,53,1],[181,56,1],[181,59,1],[184,62,1],[184,65,1],[187,65,1],[187,68,1],[187,71,1],[187,74,1],[187,77,1],[184,80,3],[184,83,3],[184,86,3],[184,89,3],[184,92,3],[181,95,3],[181,98,3],[178,101,3],[175,104,3],[175,107,3],[172,107,3],[169,110,3],[166,113,3],[163,113,3],[160,116,3],[157,116,3],[154,116,3],[151,116,3],[148,116,1],[145,116,3],[142,116,3],[139,116,3],[136,116,3],[133,113,3],[130,113,3],[127,110,3],[124,107,3],[121,107,3],[121,104,3],[118,101,3],[115,98,3],[115,95,3],[112,92,3],[112,89,3],[112,86,3],[112,83,3],[112,80,3],[112,77,3],[112,74,3],[112,71,3],[112,68,3],[115,65,3],[115,62,3],[118,59,3],[121,56,3],[121,53,3],[124,53,3],[127,50,3],[130,47,3],[133,47,3],[136,44,3],[139,44,3],[142,44,3],[145,44,3],[148,44,1],[151,44,3],[154,44,3],[157,44,3],[160,44,3],[163,47,3],[166,47,3],[169,50,3],[172,53,3],[175,53,3],[175,56,3],[178,59,3],[181,62,3],[181,65,3],[184,68,3],[184,71,3],[184,74,3],[184,77,3